{
  "baseline_commit": "0aac58e466d583d0f0436df7b8afa3dc96191263",
  "cases": [
    {
      "expected": {
        "action": "reject",
        "balance_after": null
      },
      "id": "missing_user_rejects",
      "input": {
        "amount": "0.75",
        "balance": "missing",
        "message_id": "bill-missing",
        "routing_key": "bill_request.submit_sm_resp.1",
        "user_id": "1"
      }
    },
    {
      "expected": {
        "action": "reject",
        "balance_after": 0.74
      },
      "id": "insufficient_balance_rejects_unchanged",
      "input": {
        "amount": "0.75",
        "balance": 0.74,
        "message_id": "bill-insufficient",
        "routing_key": "bill_request.submit_sm_resp.2",
        "user_id": "2"
      }
    },
    {
      "expected": {
        "action": "ack",
        "balance_after": 0.0
      },
      "id": "exact_balance_acks_and_decrements",
      "input": {
        "amount": "0.75",
        "balance": 0.75,
        "message_id": "bill-exact",
        "routing_key": "bill_request.submit_sm_resp.3",
        "user_id": "3"
      }
    },
    {
      "expected": {
        "action": "ack",
        "balance_after": 1.25
      },
      "id": "sufficient_balance_acks_and_decrements",
      "input": {
        "amount": "0.75",
        "balance": 2.0,
        "message_id": "bill-sufficient",
        "routing_key": "bill_request.submit_sm_resp.4",
        "user_id": "4"
      }
    },
    {
      "expected": {
        "action": "ack",
        "balance_after": 2.0
      },
      "id": "zero_amount_acks_without_delta",
      "input": {
        "amount": "0",
        "balance": 2.0,
        "message_id": "bill-zero",
        "routing_key": "bill_request.submit_sm_resp.5",
        "user_id": "5"
      }
    },
    {
      "expected": {
        "action": "ack",
        "balance_after": 1.25
      },
      "id": "opaque_user_id_acks_and_decrements",
      "input": {
        "amount": "0.75",
        "balance": 2.0,
        "message_id": "bill-opaque",
        "routing_key": "bill_request.submit_sm_resp.alice_1",
        "user_id": "alice_1"
      }
    },
    {
      "expected": {
        "action": "none",
        "balance_after": null
      },
      "id": "unlimited_balance_has_no_terminal_action",
      "input": {
        "amount": "0.75",
        "balance": null,
        "message_id": "bill-unlimited",
        "routing_key": "bill_request.submit_sm_resp.6",
        "user_id": "6"
      }
    }
  ],
  "cases_sha256": "f7ac07abb075b893294a62089ef2448c8cbe202e5317fdd3ab7e659885afcb8e",
  "schema_version": 1,
  "source": [
    "jasmin/routing/router.py:97-109",
    "jasmin/routing/router.py:235-263",
    "jasmin/managers/content.py:201-212"
  ]
}
